old_title,new_title,old_handle,new_handle,old_seo_title,new_seo_title,old_seo_description,new_seo_description,products_count,product_sample,updated,error
Torebki,Puste torby i organizery,torebki,puste-torby-i-organizery,Przezroczyste torebki do szpitala,Puste torby do szpitala i organizery | MamaPack,"Przezroczyste torebki do szpitala są idealne do przechowywania wszystkich rzeczy. Kompaktowe i wygodne, pomogą Ci szybko znaleźć potrzebne rzeczy. Kup teraz!","Puste torby do szpitala, torby dla mamy, organizery i przezroczyste kosmetyczki do samodzielnego pakowania wyprawki.",16,"Torba do szpitala-010 | Organizer na pieluchy i akcesoria - z misiem - (37,5 × 25 × 18 cm) | Drewniany ORGANIZER dziecięcy - OH BABY - z drążkiem | PIKOWANA TORBA dla mamy i niemowlęcia  – mleczna Z MOTYWEM MISIÓW | PIKOWANA TORBA do szpitala z NIEDŹWIEDZIEM -  Rozmiar: L | PIKOWANA TORBA do szpitala z haftem gałązek OLIWNYCH  - Rozmiar: L | PIKOWANA TORBA do szpitala z TULIPANAMI -  Rozmiar:  L | PIKOWANA TORBA do szpitala z MOTYWEM GWIAZDEK I KSIĘŻYCA -  Rozmiar: L",True,
Wanienki dla dzieci,Wanienki dla dzieci,wanienki-dla-dzieci,wanienki-dla-dzieci,Wanienki dla dzieci i niemowląt | MamaPack,Wanienki dla dzieci i niemowląt | MamaPack,"Wanienki dla niemowląt i dzieci: klasyczne, składane, z odpływem, w rozmiarach 86 i 102 cm. Wybierz bezpieczną wanienkę w MamaPack.","Wanienki dla niemowląt, modele z odpływem, składane wanienki oraz akcesoria do kąpieli. Wybierz wygodną wanienkę dla dziecka.",30,Tega Baby Leżaczek kąpielowy z wizerunkiem Sowa | Tega Baby Fotelik do kąpieli antypoślizgowy Sowa | Tega Baby Leżaczek kąpielowy z wizerunkiem Miś | Tega Baby Nakładka sedesowa miękka Miś | Tega Baby Fotelik do kąpieli antypoślizgowy Miś | Tega Baby Podnóżek antypoślizgowy Monsters | Tega Baby Fotelik do kąpieli antypoślizgowy Monsters | Tega Baby Leżaczek kąpielowy z wizerunkiem Meteo,True,
Wkładki laktacyjne,Wkładki laktacyjne,wkladki-laktacyjne,wkladki-laktacyjne,Wkładki laktacyjne - ochrona przed przemoczeniem,Wkładki laktacyjne jednorazowe | MamaPack,Ochrona bielizny i ubrań przed przemoczeniem w pierwszych dniach po porodzie. Często zmieniaj wkładki i dbaj o higienę piersi.,"Wkładki laktacyjne jednorazowe, cienkie i chłonne. Ochrona bielizny oraz ubrań przed przeciekaniem mleka.",10,BELLA - Wkładki laktacyjne MAMMA - (30 szt.) | CANPOL 1/653 - Wkładki laktacyjne  - (30 szt.) | AVENT SCF254/24 - Wkładki jednorazowe - (24 szt.) | B.O.298/01 - Wkładki laktacyjne NATURAL NURSING - (24 szt.) -  białe | B.O.297/01 - Wkładki laktacyjne NIGHT & DAY - (40 szt.) | AKUKU A0354 - Wkładki laktacyjne - Ultracienkie - (30 szt.) | AKUKU A0160 - Wkładki laktacyjne DAILY -  (60 szt.) | LANSINOH - Wkładki laktacyjne jednorazowe - (60 szt.),True,
Zabawa i edukacja,Zabawa i edukacja,zabawa-i-edukacja,zabawa-i-edukacja,,Zabawa i edukacja dla dziecka | MamaPack,,"Produkty do zabawy i edukacji dziecka, w tym maty piankowe. Wybierz akcesoria wspierające codzienną aktywność.",1,B.O. 1576 - Edukacyjna mata piankowa XPE - (150x200cm),True,
"Żele, mydła, szampony","Żele, mydła i szampony dla dzieci",zele-mydla-szampony,zele-mydla-szampony,Delikatne mydło dla noworodka,"Żele, mydła i szampony dla dzieci | MamaPack",Hipoalergiczne mydło dla noworodka. Delikatnie oczyszcza skórę od pierwszych dni życia.,"Żele, mydła, płyny do kąpieli i szampony dla niemowląt. Delikatne kosmetyki do mycia ciała i włosów dziecka.",8,Ziaja - Płyn do kąpieli dla dzieci i niemowląt natłuszczający | SKARB MATKI - Delikatna Pianka do mycia niemowląt - 250ml | NIVEA BABY -  ŻEL 2w1 - do mycia ciała i włosów - na dobranoc - (200 ml) | NIVEA BABY (80512) - ŻEL 2w1 do mycia ciała i włosów - z dozownikiem - (500 ml) | LINOMAG - Żel do mycia ciała i głowy - dla dzieci i niemowląt - (200 ML) | CHICCO 00010580000000 - Płyn do kąpieli protection  0m+ (500ml) | Bobini Baby - Żel do mycia ciała i włosów dla niemowląt - 2w1 - (300ml) | BAMBINO 83671 - Żel do mycia ciała i włosów - 2w1 - (400ml),True,
